 sudo sg_inq /dev/sg1
invalid VPD response; probably a STANDARD INQUIRY response
standard INQUIRY:
  PQual=0  PDT=0  RMB=1  LU_CONG=0  hot_pluggable=0  version=0x02  [SCSI-2]
  [AERC=0]  [TrmTsk=0]  NormACA=0  HiSUP=0  Resp_data_format=2
  SCCS=0  ACC=0  TPGS=0  3PC=0  Protect=0  [BQue=0]
  EncServ=0  MultiP=0  [MChngr=0]  [ACKREQQ=0]  Addr16=0
  [RelAdr=0]  WBus16=0  Sync=0  [Linked=0]  [TranDis=0]  CmdQue=0
    length=36 (0x24)   Peripheral device type: disk
 Vendor identification: DV17    
 Product identification:  DEVICE V1.00   
 Product revision level: 1.00

 sudo dd if=/dev/sdb bs=512 count=1 | hexdump -C 
dd: failed to open '/dev/sdb': No medium found

$ sudo usb_modeswitch -v 1224 -p 2725
Look for default devices ...
 Found devices in default mode (1)
Access device 064 on bus 001
Get the current device configuration ...
Current configuration number is 1
Use interface number 0
 with class 8
Warning: no switching method given. See documentation
-> Run lsusb to note any changes. Bye!

$ sudo sg_readcap -l /dev/sg1
bad field in READ CAPACITY (16) cdb including unsupported service action
sg_readcap failed: Illegal request

p$ sudo sg_logs -a /dev/sg1
    DV17       DEVICE V1.00     1.00
log_sense: field in cdb illegal
sg_logs failed: Illegal request

$ sudo usbreset 1224:2725
Resetting USB PHY 2.0 ... ok

$ udevadm info --query=all --name=/dev/sdb
P: /devices/pci0000:00/0000:00:14.0/usb1/1-11/1-11.2/1-11.2.2/1-11.2.2:1.0/host6/target6:0:0/6:0:0:0/block/sdb
N: sdb
L: 0
S: disk/by-path/pci-0000:00:14.0-usb-0:11.2.2:1.0-scsi-0:0:0:0
S: disk/by-id/usb-DV17_DEVICE_V1.00-0:0
E: DEVPATH=/devices/pci0000:00/0000:00:14.0/usb1/1-11/1-11.2/1-11.2.2/1-11.2.2:1.0/host6/target6:0:0/6:0:0:0/block/sdb
E: DEVNAME=/dev/sdb
E: DEVTYPE=disk
E: DISKSEQ=30
E: MAJOR=8
E: MINOR=16
E: SUBSYSTEM=block
E: USEC_INITIALIZED=153105565577
E: ID_VENDOR=DV17
E: ID_VENDOR_ENC=DV17\x20\x20\x20\x20
E: ID_VENDOR_ID=1224
E: ID_MODEL=DEVICE_V1.00
E: ID_MODEL_ENC=\x20DEVICE\x20V1.00\x20\x20\x20
E: ID_MODEL_ID=2725
E: ID_REVISION=1.00
E: ID_SERIAL=DV17_DEVICE_V1.00-0:0
E: ID_TYPE=disk
E: ID_INSTANCE=0:0
E: ID_BUS=usb
E: ID_USB_INTERFACES=:080650:
E: ID_USB_INTERFACE_NUM=00
E: ID_USB_DRIVER=usb-storage
E: ID_PATH=pci-0000:00:14.0-usb-0:11.2.2:1.0-scsi-0:0:0:0
E: ID_PATH_TAG=pci-0000_00_14_0-usb-0_11_2_2_1_0-scsi-0_0_0_0
E: DEVLINKS=/dev/disk/by-path/pci-0000:00:14.0-usb-0:11.2.2:1.0-scsi-0:0:0:0 /dev/disk/by-id/usb-DV17_DEVICE_V1.00-0:0
E: TAGS=:systemd:
E: CURRENT_TAGS=:systemd:

$ lsusb -t
/:  Bus 02.Port 1: Dev 1, Class=root_hub, Driver=xhci_hcd/10p, 10000M
/:  Bus 01.Port 1: Dev 1, Class=root_hub, Driver=xhci_hcd/16p, 480M
    |__ Port 2: Dev 2, If 0, Class=Hub, Driver=hub/3p, 480M
        |__ Port 1: Dev 4, If 1, Class=Human Interface Device, Driver=usbhid, 12M
        |__ Port 1: Dev 4, If 2, Class=Human Interface Device, Driver=usbhid, 12M
        |__ Port 1: Dev 4, If 0, Class=Human Interface Device, Driver=usbhid, 12M
        |__ Port 3: Dev 59, If 2, Class=Human Interface Device, Driver=usbhid, 12M
        |__ Port 3: Dev 59, If 0, Class=Human Interface Device, Driver=usbhid, 12M
        |__ Port 3: Dev 59, If 3, Class=Human Interface Device, Driver=usbhid, 12M
        |__ Port 3: Dev 59, If 1, Class=Human Interface Device, Driver=usbhid, 12M
    |__ Port 9: Dev 58, If 0, Class=Video, Driver=uvcvideo, 480M
    |__ Port 9: Dev 58, If 1, Class=Video, Driver=uvcvideo, 480M
    |__ Port 9: Dev 58, If 2, Class=Video, Driver=uvcvideo, 480M
    |__ Port 9: Dev 58, If 3, Class=Audio, Driver=snd-usb-audio, 480M
    |__ Port 9: Dev 58, If 4, Class=Audio, Driver=snd-usb-audio, 480M
    |__ Port 11: Dev 3, If 0, Class=Hub, Driver=hub/4p, 480M
        |__ Port 3: Dev 8, If 0, Class=Wireless, Driver=btusb, 12M
        |__ Port 3: Dev 8, If 1, Class=Wireless, Driver=btusb, 12M
        |__ Port 2: Dev 60, If 0, Class=Hub, Driver=hub/7p, 480M
            |__ Port 4: Dev 62, If 0, Class=Human Interface Device, Driver=usbhid, 12M
            |__ Port 4: Dev 62, If 3, Class=Human Interface Device, Driver=usbhid, 12M
            |__ Port 4: Dev 62, If 1, Class=Human Interface Device, Driver=usbhid, 12M
            |__ Port 4: Dev 62, If 2, Class=Human Interface Device, Driver=usbhid, 12M
            |__ Port 2: Dev 64, If 0, Class=Mass Storage, Driver=usb-storage, 480M
            |__ Port 7: Dev 63, If 0, Class=Vendor Specific Class, Driver=, 480M
            |__ Port 3: Dev 61, If 0, Class=Human Interface Device, Driver=usbhid, 12M
    |__ Port 12: Dev 5, If 0, Class=Human Interface Device, Driver=usbhid, 12M
