l@cker:~$ xrandr --query
xrandr: Failed to get size of gamma for output default
Screen 0: minimum 4096 x 2160, current 4096 x 2160, maximum 4096 x 2160
default connected 4096x2160+0+0 0mm x 0mm
   4096x2160      0.00* 
#########################################################################
 $cat /sys/class/drm/card2/card2-DVI-I-2/edid | edid-decode
edid-decode (hex):

00 ff ff ff ff ff ff 00 05 d7 00 00 00 00 00 00
ff 22 01 03 80 32 1f 78 07 ee 95 a3 54 4c 99 26
0f 50 54 00 00 00 01 01 01 01 01 01 01 01 01 01
01 01 01 01 01 01 60 18 80 a0 70 e0 14 10 30 20
3a 00 40 90 20 00 00 02 00 00 00 fd 00 17 f0 0f
ff 06 00 0a 20 20 20 20 20 20 00 00 00 fc 00 31
39 32 30 78 34 34 30 20 43 56 54 0a 00 00 00 00
00 00 00 00 00 00 00 00 00 00 00 00 00 00 01 13

02 03 18 40 23 09 06 07 67 03 0c 00 00 00 10 0c
67 d8 5d c4 01 0c 80 00 00 00 00 00 00 00 00 00
00 00 00 00 00 00 00 00 00 00 00 00 00 00 00 00
00 00 00 00 00 00 00 00 00 00 00 00 00 00 00 00
00 00 00 00 00 00 00 00 00 00 00 00 00 00 00 00
00 00 00 00 00 00 00 00 00 00 00 00 00 00 00 00
00 00 00 00 00 00 00 00 00 00 00 00 00 00 00 00
00 00 00 00 00 00 00 00 00 00 00 00 00 00 00 eb

----------------

Block 0, Base EDID:
  EDID Structure Version & Revision: 1.3
  Vendor & Product Identification:
    Manufacturer: ANW
    Model: 0
    Model year: 2024
  Basic Display Parameters & Features:
    Digital display
    Maximum image size: 50 cm x 31 cm
    Gamma: 2.20
    Monochrome or grayscale display
    Default (sRGB) color space is primary color space
    First detailed timing is the preferred timing
    Supports GTF timings within operating range
  Color Characteristics:
    Red  : 0.6396, 0.3300
    Green: 0.2998, 0.5996
    Blue : 0.1503, 0.0595
    White: 0.3134, 0.3291
  Established Timings I & II: none
  Standard Timings: none
  Detailed Timing Descriptors:
    DTD 1:  1920x480    60.000 Hz   4:1    30.000 kHz  62.400 MHz (analog composite, 576 mm x 144 mm)
                 Hfront   48 Hsync  32 Hback  80 Hpol N
                 Vfront    3 Vsync  10 Vback   7 Vpol N
  Display Range Limits:
    Monitor ranges (GTF): 23-240 Hz V, 15-255 kHz H, max dotclock 60 MHz
    Display Product Name: '1920x440 CVT'
    Empty Descriptor
  Extension blocks: 1
Checksum: 0x13

----------------

Block 1, CTA-861 Extension Block:
  Revision: 3
  Basic audio support
  Native detailed modes: 0
  Audio Data Block:
    Linear PCM:
      Max channels: 2
      Supported sample rates (kHz): 48 44.1
      Supported sample sizes (bits): 24 20 16
  Vendor-Specific Data Block (HDMI), OUI 00-0C-03:
    Source physical address: 0.0.0.0
    DC_30bit
    Maximum TMDS clock: 60 MHz
  Vendor-Specific Data Block (HDMI Forum), OUI C4-5D-D8:
    Version: 1
    Maximum TMDS Character Rate: 60 MHz
    SCDC Present
Checksum: 0xeb


 #########################################################################  
l@cker:~$ cvt 1920 480 60

# 1920x480 59.79 Hz (CVT) hsync: 29.90 kHz; pclk: 71.75 MHz
Modeline "1920x480_60.00"   71.75  1920 1976 2160 2400  480 483 493 500 -hsync +vsync

xrandr --newmode "1920x480_60.00" 71.75  1920 1976 2160 2400  480 483 493 500 -hsync +vsync

xrandr --newmode "1920x480_60.00" 71.75  1920 1976 2160 2400  480 483 493 500 -hsync +vsync
xrandr: Failed to get size of gamma for output default
##################### SEEK pkgs & reboot ##############################################################
sudo apt install dkms
sudo apt install evdi-dkms
sudo apt install dkms libdrm-dev libssl-dev

sudo apt install displaylink-driver

######################################################################################################
sudo cp /etc/X11/xorg.conf.d/20-evdi.conf /etc/X11/xorg.conf.d/20-evdi.conf_bkp
sudo vim /etc/X11/xorg.conf.d/20-evdi.conf

Section "Device"
    Identifier "DisplayLink"
    Driver "modesetting"
    Option "AccelMethod" "none"
    Option "kmsdev" "/dev/dri/card2"
EndSection

Section "Screen"
    Identifier "Screen0"
    Device "DisplayLink"
    Monitor "Monitor0"
    DefaultDepth 24
    SubSection "Display"
        Depth 24
        Modes "1920x480"
    EndSubSection
EndSection

Section "Monitor"
    Identifier "Monitor0"
    Option "PreferredMode" "1920x480"
EndSection



xrandr --addmode DVI-I-2 "1920x480_60.00"
